<?xml version="1.0" encoding="UTF-8"?>

<!DOCTYPE guard:user SYSTEM "/Users/snow_young/secrect/opensource/mycat-netty/src/main/resources/user.dtd">
<guard:user xmlns:guard="http://snow4young.org/">
    <user name="xujianhai">
        <property name="password">xujianhai</property>
        <property name="schemas">schema,testdb</property>
        <property name="readOnly">true</property>
    </user>

    <user name="user">
        <property name="password">xujianhai</property>
        <property name="schemas">schema,testdb</property>
        <property name="readOnly">true</property>
    </user>

    <user name="laoshan">
        <property name="password">xujianhai</property>
        <property name="schemas">schema,testdb</property>
        <property name="readOnly">true</property>
    </user>

    <quarantine>
        <whitehost>
            <host host="127.0.0.1" user="xujianhai,user,laoshan"/>
            <host host="127.0.0.2" user="xujianhai"/>
        </whitehost>
        <blacklist check="false"></blacklist>
    </quarantine>

</guard:user>